{
	"server": {
		"backend": {
			"host": "localhost",
			"port": 3000,
			"protocol": "http",
			"baseUrl": "http://localhost:3000"
		},
		"socket": {
			"host": "localhost",
			"port": 30090,
			"protocol": "ws",
			"baseUrl": "ws://localhost:30090"
		},
		"frontend": {
			"host": "localhost",
			"port": 5173,
			"protocol": "http",
			"baseUrl": "http://localhost:5173"
		}
	},
	"api": {
		"endpoints": {
			"auth": {
				"login": "/api/v0/account/login",
				"logout": "/api/v0/account/logout",
				"refresh": "/api/v0/account/refresh"
			},
			"company": {
				"list": "/api/v0/corp/list",
				"create": "/api/v0/corp/list",
				"add": "/api/v0/corp/add",
				"update": "/api/v0/corp/list/:id",
				"delete": "/api/v0/corp/delete"
			},
			"file": {
				"check": "/api/v0/center/file/chk",
				"show": "/api/v0/center/file/show",
				"item": "/api/v0/center/file/item"
			},
			"invoice": {
				"list": "/api/v0/center/invoice/list",
				"corp": "/api/v0/center/invoice/corp"
			},
			"cam": {
				"data": {
					"receipts": "/api/v0/cam/data/receipts",
					"download": {
						"single": "/api/v0/cam/data/download/single",
						"multi": "/api/v0/cam/data/download/multi"
					},
					"complete": "/api/v0/cam/data/complete",
					"delete": "/api/v0/cam/data/delete"
				},
				"progress": "/api/v0/cam/data/progress"
			},
			"data": {
				"create": {
					"ok": "/api/v0/center/data/create/ok",
					"re": "/api/v0/center/data/create/re"
				}
			},
			"setting": {
				"users": "/api/v0/setting/users",
				"user": "/api/v0/setting/user",
				"userrole": "/api/v0/setting/roles",
				"site": "/api/v0/setting/site"
			},
			"price": {
				"list": "/api/v0/price/list",
				"upload": "/api/v0/price/upload",
				"search": "/api/v0/price/search",
				"type": "/api/v0/price/list/type",
				"update": "/api/v0/price/list/:id"
			},
			"monitoring": {
				"system": "/api/v0/monitoring/system",
				"summary": "/api/v0/monitoring/summary",
				"cpu": "/api/v0/monitoring/cpu",
				"memory": "/api/v0/monitoring/memory",
				"disk": "/api/v0/monitoring/disk",
				"network": "/api/v0/monitoring/network",
				"process": "/api/v0/monitoring/process",
				"health": "/api/v0/monitoring/health",
				"start": "/api/v0/monitoring/start",
				"stop": "/api/v0/monitoring/stop",
				"networkDrives": "/api/v0/monitoring/network-drives",
				"networkStorageSummary": "/api/v0/monitoring/network-storage-summary"
			}
		}
	},
	"socket": {
		"channels": {
			"camPrint": "cam/print"
		},
		"reconnect": {
			"maxAttempts": 5,
			"interval": 3000
		},
		"timeout": {
			"connection": 10000,
			"message": 5000
		}
	},
	"app": {
		"name": "ToothFairy",
		"version": "1.0.0",
		"environment": "production",
		"debug": false,
		"features": {
			"socket": true,
			"notifications": true,
			"mobile": true
		}
	},
	"security": {
		"jwt": {
			"secret": "your-jwt-secret-key-prod",
			"expiresIn": "1h",
			"refreshExpiresIn": "7d"
		},
		"cors": {
			"origin": ["http://localhost:5173", "http://localhost:3000"],
			"credentials": true
		},
		"cookies": {
			"accessToken": {
				"name": "access_token",
				"httpOnly": true,
				"secure": true,
				"sameSite": "lax",
				"maxAge": 3600000
			},
			"refreshToken": {
				"name": "refresh_token",
				"httpOnly": true,
				"secure": true,
				"sameSite": "lax",
				"maxAge": 604800000
			}
		}
	},
	"database": {
		"type": "sqlite",
		"host": "localhost",
		"port": 3306,
		"name": "toothfairy_prod",
		"username": "prod_user",
		"password": "prod_password"
	},
	"logging": {
		"level": "info",
		"file": "logs/app-prod.log",
		"console": false
	}
}
